{
  "schemaVersion": 1,
  "manifestId": "headshot.hair.texture",
  "fieldId": "hair.texture",
  "sectionId": "hair",
  "visualStyleVersion": "headshot-illustrated-v1",
  "assetFamily": "illustrated-set",
  "recolorMode": "mask",
  "sourceSheet": {
    "filename": "hair-texture-set-r1.png",
    "revision": 1,
    "rows": 1,
    "columns": 4,
    "sliceStrategy": "grid",
    "width": null,
    "height": null
  },
  "runtimeProfiles": {
    "master": { "width": 512, "height": 512, "format": "png" },
    "preview": { "width": 256, "height": 256, "format": "png" },
    "thumb": { "width": 128, "height": 128, "format": "png" }
  },
  "items": [
    {
      "assetId": "visual.hair.texture.silky-smooth",
      "optionId": "hair.texture.silky_smooth",
      "slug": "silky-smooth",
      "row": 1,
      "column": 1,
      "sourceBounds": null,
      "assetRevision": 1,
      "overrideFilename": null,
      "focalPoint": "50% 50%",
      "alt": { "en": "Silky smooth hair texture in clean line art", "th": "Silky smooth hair texture in clean line art" },
      "reviewStatus": "sliced"
    },
    {
      "assetId": "visual.hair.texture.coarse-thick",
      "optionId": "hair.texture.coarse_thick",
      "slug": "coarse-thick",
      "row": 1,
      "column": 2,
      "sourceBounds": null,
      "assetRevision": 1,
      "overrideFilename": null,
      "focalPoint": "50% 50%",
      "alt": { "en": "Coarse thick hair texture in clean line art", "th": "Coarse thick hair texture in clean line art" },
      "reviewStatus": "sliced"
    },
    {
      "assetId": "visual.hair.texture.soft-glossy-waves",
      "optionId": "hair.texture.soft_glossy_waves",
      "slug": "soft-glossy-waves",
      "row": 1,
      "column": 3,
      "sourceBounds": { "left": 960, "top": 0, "width": 420, "height": 819 },
      "assetRevision": 1,
      "overrideFilename": null,
      "focalPoint": "50% 50%",
      "alt": { "en": "Soft glossy wave hair texture in clean line art", "th": "Soft glossy wave hair texture in clean line art" },
      "reviewStatus": "sliced"
    },
    {
      "assetId": "visual.hair.texture.frizzy-voluminous",
      "optionId": "hair.texture.frizzy_voluminous",
      "slug": "frizzy-voluminous",
      "row": 1,
      "column": 4,
      "sourceBounds": null,
      "assetRevision": 1,
      "overrideFilename": null,
      "focalPoint": "50% 50%",
      "alt": { "en": "Frizzy voluminous hair texture in clean line art", "th": "Frizzy voluminous hair texture in clean line art" },
      "reviewStatus": "sliced"
    }
  ]
}
