{
  "schemaVersion": 1,
  "manifestId": "headshot.hair.cut-style",
  "fieldId": "hair.cut_style",
  "sectionId": "hair",
  "visualStyleVersion": "headshot-illustrated-v1",
  "assetFamily": "illustrated-set",
  "recolorMode": "mask",
  "sourceSheet": {
    "filename": "hair-cut-style-set-r1.png",
    "revision": 1,
    "rows": 4,
    "columns": 4,
    "sliceStrategy": "grid",
    "width": null,
    "height": null
  },
  "runtimeProfiles": {
    "master": { "width": 512, "height": 512, "format": "png" },
    "preview": { "width": 256, "height": 256, "format": "png" },
    "thumb": { "width": 128, "height": 128, "format": "png" }
  },
  "items": [
    {
      "assetId": "visual.hair.cut-style.ponytail",
      "optionId": "hair.cut_style.ponytail",
      "slug": "ponytail",
      "row": 1,
      "column": 1,
      "sourceBounds": null,
      "assetRevision": 1,
      "overrideFilename": null,
      "focalPoint": "50% 48%",
      "alt": { "en": "High ponytail hairstyle in clean line art", "th": "High ponytail hairstyle in clean line art" },
      "reviewStatus": "sliced"
    },
    {
      "assetId": "visual.hair.cut-style.messy-bun",
      "optionId": "hair.cut_style.messy_bun",
      "slug": "messy-bun",
      "row": 1,
      "column": 2,
      "sourceBounds": null,
      "assetRevision": 1,
      "overrideFilename": null,
      "focalPoint": "50% 48%",
      "alt": { "en": "Messy bun hairstyle in clean line art", "th": "Messy bun hairstyle in clean line art" },
      "reviewStatus": "sliced"
    },
    {
      "assetId": "visual.hair.cut-style.french-braid",
      "optionId": "hair.cut_style.french_braid",
      "slug": "french-braid",
      "row": 1,
      "column": 3,
      "sourceBounds": null,
      "assetRevision": 1,
      "overrideFilename": null,
      "focalPoint": "50% 50%",
      "alt": { "en": "French braid hairstyle in clean line art", "th": "French braid hairstyle in clean line art" },
      "reviewStatus": "sliced"
    },
    {
      "assetId": "visual.hair.cut-style.layered-hush-cut",
      "optionId": "hair.cut_style.layered_hush_cut",
      "slug": "layered-hush-cut",
      "row": 1,
      "column": 4,
      "sourceBounds": null,
      "assetRevision": 1,
      "overrideFilename": null,
      "focalPoint": "50% 50%",
      "alt": { "en": "Layered hush cut hairstyle in clean line art", "th": "Layered hush cut hairstyle in clean line art" },
      "reviewStatus": "sliced"
    },
    {
      "assetId": "visual.hair.cut-style.long-loose-waves",
      "optionId": "hair.cut_style.long_loose_waves",
      "slug": "long-loose-waves",
      "row": 2,
      "column": 1,
      "sourceBounds": null,
      "assetRevision": 1,
      "overrideFilename": null,
      "focalPoint": "50% 54%",
      "alt": { "en": "Long loose waves hairstyle in clean line art", "th": "Long loose waves hairstyle in clean line art" },
      "reviewStatus": "sliced"
    },
    {
      "assetId": "visual.hair.cut-style.side-swept",
      "optionId": "hair.cut_style.side_swept",
      "slug": "side-swept",
      "row": 2,
      "column": 2,
      "sourceBounds": null,
      "assetRevision": 1,
      "overrideFilename": null,
      "focalPoint": "50% 54%",
      "alt": { "en": "Side-swept hairstyle in clean line art", "th": "Side-swept hairstyle in clean line art" },
      "reviewStatus": "sliced"
    },
    {
      "assetId": "visual.hair.cut-style.wet-look",
      "optionId": "hair.cut_style.wet_look",
      "slug": "wet-look",
      "row": 2,
      "column": 3,
      "sourceBounds": { "left": 627, "top": 340, "width": 314, "height": 287 },
      "assetRevision": 1,
      "overrideFilename": null,
      "focalPoint": "50% 50%",
      "alt": { "en": "Wet look hairstyle in clean line art", "th": "Wet look hairstyle in clean line art" },
      "reviewStatus": "sliced"
    },
    {
      "assetId": "visual.hair.cut-style.wolf-cut",
      "optionId": "hair.cut_style.wolf_cut",
      "slug": "wolf-cut",
      "row": 2,
      "column": 4,
      "sourceBounds": null,
      "assetRevision": 1,
      "overrideFilename": null,
      "focalPoint": "50% 52%",
      "alt": { "en": "Wolf cut hairstyle in clean line art", "th": "Wolf cut hairstyle in clean line art" },
      "reviewStatus": "sliced"
    },
    {
      "assetId": "visual.hair.cut-style.crew-cut",
      "optionId": "hair.cut_style.crew_cut",
      "slug": "crew-cut",
      "row": 3,
      "column": 1,
      "sourceBounds": { "left": 0, "top": 655, "width": 314, "height": 285 },
      "assetRevision": 1,
      "overrideFilename": null,
      "focalPoint": "50% 50%",
      "alt": { "en": "Crew cut hairstyle in clean line art", "th": "Crew cut hairstyle in clean line art" },
      "reviewStatus": "sliced"
    },
    {
      "assetId": "visual.hair.cut-style.side-part",
      "optionId": "hair.cut_style.side_part",
      "slug": "side-part",
      "row": 3,
      "column": 2,
      "sourceBounds": { "left": 314, "top": 655, "width": 314, "height": 285 },
      "assetRevision": 1,
      "overrideFilename": null,
      "focalPoint": "50% 50%",
      "alt": { "en": "Side part hairstyle in clean line art", "th": "Side part hairstyle in clean line art" },
      "reviewStatus": "sliced"
    },
    {
      "assetId": "visual.hair.cut-style.undercut",
      "optionId": "hair.cut_style.undercut",
      "slug": "undercut",
      "row": 3,
      "column": 3,
      "sourceBounds": null,
      "assetRevision": 1,
      "overrideFilename": null,
      "focalPoint": "50% 50%",
      "alt": { "en": "Undercut hairstyle in clean line art", "th": "Undercut hairstyle in clean line art" },
      "reviewStatus": "sliced"
    },
    {
      "assetId": "visual.hair.cut-style.pompadour",
      "optionId": "hair.cut_style.pompadour",
      "slug": "pompadour",
      "row": 3,
      "column": 4,
      "sourceBounds": null,
      "assetRevision": 1,
      "overrideFilename": null,
      "focalPoint": "50% 50%",
      "alt": { "en": "Pompadour hairstyle in clean line art", "th": "Pompadour hairstyle in clean line art" },
      "reviewStatus": "sliced"
    },
    {
      "assetId": "visual.hair.cut-style.quiff",
      "optionId": "hair.cut_style.quiff",
      "slug": "quiff",
      "row": 4,
      "column": 1,
      "sourceBounds": null,
      "assetRevision": 1,
      "overrideFilename": null,
      "focalPoint": "50% 50%",
      "alt": { "en": "Quiff hairstyle in clean line art", "th": "Quiff hairstyle in clean line art" },
      "reviewStatus": "sliced"
    },
    {
      "assetId": "visual.hair.cut-style.textured-crop",
      "optionId": "hair.cut_style.textured_crop",
      "slug": "textured-crop",
      "row": 4,
      "column": 2,
      "sourceBounds": null,
      "assetRevision": 1,
      "overrideFilename": null,
      "focalPoint": "50% 50%",
      "alt": { "en": "Textured crop hairstyle in clean line art", "th": "Textured crop hairstyle in clean line art" },
      "reviewStatus": "sliced"
    },
    {
      "assetId": "visual.hair.cut-style.caesar-cut",
      "optionId": "hair.cut_style.caesar_cut",
      "slug": "caesar-cut",
      "row": 4,
      "column": 3,
      "sourceBounds": null,
      "assetRevision": 1,
      "overrideFilename": null,
      "focalPoint": "50% 50%",
      "alt": { "en": "Caesar cut hairstyle in clean line art", "th": "Caesar cut hairstyle in clean line art" },
      "reviewStatus": "sliced"
    },
    {
      "assetId": "visual.hair.cut-style.short-curly-crop",
      "optionId": "hair.cut_style.short_curly_crop",
      "slug": "short-curly-crop",
      "row": 4,
      "column": 4,
      "sourceBounds": null,
      "assetRevision": 1,
      "overrideFilename": null,
      "focalPoint": "50% 50%",
      "alt": { "en": "Short curly crop hairstyle in clean line art", "th": "Short curly crop hairstyle in clean line art" },
      "reviewStatus": "sliced"
    }
  ]
}
